{
  "$schema": "../schema.json",
  "slug": "milkbox",
  "name": "milkbox",
  "tagline": "A chat with yourself. Drop text, links, and files; they land on every device.",
  "type": "source-build",
  "author": { "name": "kypflug", "url": "https://github.com/kypflug" },
  "source": "https://github.com/kypflug/milkbox",
  "build": {
    "repo": "kypflug/milkbox",
    "ref": "6caa527a7af5d8244ce6c615cad8697a98f63d5d",
    "install": "npm ci",
    "command": "npm run build",
    "output": "dist"
  },
  "tags": ["pwa", "sync", "onedrive"],
  "accent": "#2d5c8a",
  "thumbnail": { "light": "assets/shots/milkbox.jpg", "dark": "assets/shots/milkbox-dark.jpg" },
  "added": "2026-07-29",
  "visible": true
}
